{"contractVersion":1,"module":"gemstone_py_native_compat","sessionClass":"NativeCompatibilitySession","handleClass":"OopHandle","returnPolicy":"object identity returns OopHandle, raw native OOPs stay below the package boundary, and typed helpers are opt-in","methods":[{"pythonMethod":"login_from_env","nativeMethod":"NativeSession.login_from_env","nativeReturn":"NativeSession","pythonReturn":"NativeCompatibilitySession","note":"constructs the package-level compatibility wrapper"},{"pythonMethod":"session_id","nativeMethod":"NativeSession.session_id","nativeReturn":"int","pythonReturn":"int","note":"passes the native session id through unchanged"},{"pythonMethod":"eval_repr","nativeMethod":"NativeSession.eval_repr","nativeReturn":"str","pythonReturn":"str","note":"debug representation helper for diagnostics"},{"pythonMethod":"eval_value","nativeMethod":"NativeSession.eval_json","nativeReturn":"str","pythonReturn":"dict","note":"returns the stable PyNativeValue JSON shape as a Python dictionary"},{"pythonMethod":"eval_smallint","nativeMethod":"NativeSession.eval_smallint","nativeReturn":"int","pythonReturn":"int","note":"typed helper remains explicit opt-in"},{"pythonMethod":"eval_oop","nativeMethod":"NativeSession.eval_oop","nativeReturn":"u64","pythonReturn":"OopHandle","note":"wraps raw object identity before package callers see it"},{"pythonMethod":"execute","nativeMethod":"NativeSession.execute","nativeReturn":"u64","pythonReturn":"OopHandle","note":"wraps raw object identity before package callers see it"},{"pythonMethod":"resolve","nativeMethod":"NativeSession.resolve","nativeReturn":"u64","pythonReturn":"OopHandle","note":"wraps resolved globals/classes as handles"},{"pythonMethod":"perform_oop","nativeMethod":"NativeSession.perform_raw_oop","nativeReturn":"u64","pythonReturn":"OopHandle","note":"accepts OopHandle or int arguments and returns a handle"},{"pythonMethod":"perform_value","nativeMethod":"NativeSession.perform_json","nativeReturn":"str","pythonReturn":"dict","note":"accepts OopHandle or int arguments and returns the stable PyNativeValue JSON shape as a Python dictionary"},{"pythonMethod":"new_string","nativeMethod":"NativeSession.new_string","nativeReturn":"u64","pythonReturn":"OopHandle","note":"returns the GemStone string object identity as a handle"},{"pythonMethod":"new_symbol","nativeMethod":"NativeSession.new_symbol","nativeReturn":"u64","pythonReturn":"OopHandle","note":"returns the GemStone symbol object identity as a handle"},{"pythonMethod":"fetch_string","nativeMethod":"NativeSession.fetch_string","nativeReturn":"str","pythonReturn":"str","note":"accepts OopHandle or int and returns a Python string"},{"pythonMethod":"global_get","nativeMethod":"NativeSession.global_get","nativeReturn":"u64","pythonReturn":"OopHandle","note":"wraps UserGlobals values as handles"},{"pythonMethod":"global_put_oop","nativeMethod":"NativeSession.global_put_raw","nativeReturn":"None","pythonReturn":"None","note":"accepts OopHandle or int and writes the raw OOP below the package boundary"},{"pythonMethod":"global_put_string","nativeMethod":"NativeSession.global_put_string","nativeReturn":"None","pythonReturn":"None","note":"typed helper remains explicit opt-in"},{"pythonMethod":"global_put_smallint","nativeMethod":"NativeSession.global_put_smallint","nativeReturn":"None","pythonReturn":"None","note":"typed helper remains explicit opt-in"},{"pythonMethod":"value_to_oop_nil","nativeMethod":"NativeSession.value_to_oop_nil","nativeReturn":"u64","pythonReturn":"OopHandle","note":"explicit typed conversion helper for nil"},{"pythonMethod":"value_to_oop_bool","nativeMethod":"NativeSession.value_to_oop_bool","nativeReturn":"u64","pythonReturn":"OopHandle","note":"explicit typed conversion helper for booleans"},{"pythonMethod":"value_to_oop_smallint","nativeMethod":"NativeSession.value_to_oop_smallint","nativeReturn":"u64","pythonReturn":"OopHandle","note":"explicit typed conversion helper for small integers"},{"pythonMethod":"value_to_oop_char","nativeMethod":"NativeSession.value_to_oop_char","nativeReturn":"u64","pythonReturn":"OopHandle","note":"explicit typed conversion helper for single-character strings"},{"pythonMethod":"value_to_oop_string","nativeMethod":"NativeSession.value_to_oop_string","nativeReturn":"u64","pythonReturn":"OopHandle","note":"explicit typed conversion helper for GemStone strings"},{"pythonMethod":"value_to_oop_symbol","nativeMethod":"NativeSession.value_to_oop_symbol","nativeReturn":"u64","pythonReturn":"OopHandle","note":"explicit typed conversion helper for GemStone symbols"},{"pythonMethod":"value_to_oop_raw","nativeMethod":"NativeSession.value_to_oop_raw","nativeReturn":"u64","pythonReturn":"OopHandle","note":"preserves raw OOP identity while wrapping it at the Python package boundary"},{"pythonMethod":"add_to_export_set","nativeMethod":"NativeSession.add_to_export_set","nativeReturn":"None","pythonReturn":"None","note":"accepts OopHandle or int for lifetime retention"},{"pythonMethod":"remove_from_export_set","nativeMethod":"NativeSession.remove_from_export_set","nativeReturn":"None","pythonReturn":"None","note":"accepts OopHandle or int for lifetime release"},{"pythonMethod":"needs_commit","nativeMethod":"NativeSession.needs_commit","nativeReturn":"bool","pythonReturn":"bool","note":"passes transaction state through unchanged"},{"pythonMethod":"in_transaction","nativeMethod":"NativeSession.in_transaction","nativeReturn":"bool","pythonReturn":"bool","note":"passes transaction state through unchanged"},{"pythonMethod":"commit","nativeMethod":"NativeSession.commit","nativeReturn":"None","pythonReturn":"None","note":"commits through the shared Rust core"},{"pythonMethod":"abort","nativeMethod":"NativeSession.abort","nativeReturn":"None","pythonReturn":"None","note":"aborts through the shared Rust core"},{"pythonMethod":"logout","nativeMethod":"NativeSession.logout","nativeReturn":"None","pythonReturn":"None","note":"logs out through the shared Rust core"}]}
